{
  "openship": "1.0",
  "capability": "discovery",
  "project": {
    "name": "Example",
    "productDescription": "An example OpenShip project.",
    "productSummary": "# Product\n\nAn example OpenShip project.",
    "technicalDescription": "A source snapshot published through OpenShip.",
    "technicalSummary": "# Implementation\n\nRetrieve the source bundle, install its dependencies, and follow its deployment documentation."
  },
  "agent": {
    "summary": "OpenShip lets this running project publish verifiable source code and optionally accept isolated changes or describe its complete system.",
    "instructions": "Call the openship tool with the agent.skill arguments before interpreting capabilities.",
    "skill": {
      "operation": "document",
      "kind": "skill"
    }
  },
  "capabilities": {
    "sources": {
      "description": "Read the published source snapshot.",
      "manifest": {
        "operation": "manifest"
      },
      "bundle": {
        "operation": "document",
        "kind": "bundle"
      }
    }
  },
  "mcpBinding": "1.0"
}
